{
  "$schema": "https://json-schema.org/draft/2020-12/schema",
  "$id": "https://github.com/stacknil/telemetry-lab/schemas/rule_hits.schema.json",
  "title": "AI-assisted detection rule hits",
  "description": "Schema for demos/ai-assisted-detection-demo/artifacts/rule_hits.json.",
  "type": "array",
  "minItems": 1,
  "items": {
    "type": "object",
    "additionalProperties": false,
    "required": [
      "hit_id",
      "rule_id",
      "rule_name",
      "severity",
      "event_family",
      "detected_at",
      "event_ids",
      "entity_keys",
      "summary",
      "evidence_highlights",
      "attack_mapping"
    ],
    "properties": {
      "hit_id": { "type": "string", "minLength": 1 },
      "rule_id": { "type": "string", "minLength": 1 },
      "rule_name": { "type": "string", "minLength": 1 },
      "severity": { "type": "string", "enum": ["low", "medium", "high", "critical"] },
      "event_family": { "type": "string", "minLength": 1 },
      "detected_at": { "type": "string", "format": "date-time" },
      "event_ids": {
        "type": "array",
        "minItems": 1,
        "items": { "type": "string", "minLength": 1 }
      },
      "entity_keys": {
        "type": "array",
        "minItems": 1,
        "items": { "type": "string", "minLength": 1 }
      },
      "summary": { "type": "string", "minLength": 1 },
      "evidence_highlights": {
        "type": "array",
        "minItems": 1,
        "items": { "type": "string", "minLength": 1 }
      },
      "attack_mapping": { "$ref": "#/$defs/attack_mapping" }
    }
  },
  "$defs": {
    "attack_mapping": {
      "type": "object",
      "additionalProperties": false,
      "required": ["tactic", "technique_id", "technique_name"],
      "properties": {
        "tactic": { "type": "string", "minLength": 1 },
        "technique_id": { "type": "string", "pattern": "^T[0-9]{4}(\\.[0-9]{3})?$" },
        "technique_name": { "type": "string", "minLength": 1 }
      }
    }
  }
}
